[{
	"buoyID":0,
	"date":"2021-09-26T11:09:00+00",
	"location":{"latitude":46.741,"longitude":11.441},
	"measurements":[
		{"sensorID":2,"sensorType":2,"measurement":4.14},
		{"sensorID":1,"sensorType":1,"measurement":5.14}
	]
},
{
    "buoyID":1,
    "date":"2021-09-26T11:09:00+00",
    "location":{"latitude":46.743,"longitude":11.445},
    "measurements":[
        {"sensorID":1,"sensorType":2,"measurement":4.15},
        {"sensorID":2,"sensorType":1,"measurement":5.15}
    ]
}]
